{
  "id": "st-stm32h743vit6-lqfp100",
  "partNumber": "STM32H743VIT6",
  "vendor": "STMicroelectronics",
  "family": "STM32H743VI",
  "core": "ARM Cortex-M7",
  "package": "LQFP100",
  "packageSize": "14x14 mm",
  "packageGeometry": { "shape": "LQFP", "pinsPerSide": 25, "numbering": "counterclockwise" },
  "pinCount": 100,
  "uiProfile": "stm32-cube",
  "status": "verified",
  "analogConvention": "st",
  "signalDialect": "st",
  "electrical": {
    "fiveVoltTolerantIoStructures": ["FT", "FT_a", "FT_f", "FT_fa", "FT_fh", "FT_fha", "FT_h", "FT_ha", "FT_u"],
    "note": "DS12110 Table 9: FT/FT_x 为 5V 容忍，TT_x 仅 3.3V。TT_a 7 脚 + TT_ha 4 脚共 11 个 GPIO 不耐 5V。"
  },
  "source": {
    "document": "DS12110",
    "revision": "11",
    "url": "https://www.st.com/resource/en/datasheet/stm32h743vi.pdf",
    "pinTablePages": "64-88",
    "afTablePages": "89-100"
  },
  "pins": [
    {
      "number": 1,
      "name": "PE2",
      "resetName": "PE2",
      "kind": "gpio",
      "ioType": "I/O",
      "ioStructure": "FT_h",
      "notes": "-",
      "alternateSummary": [
        "TRACECLK",
        "SAI1_CK1",
        "SPI4_SCK",
        "SAI1_MCLK_A",
        "SAI4_MCLK_A",
        "QUADSPI_BK1_IO2",
        "SAI4_CK1",
        "ETH_MII_TXD3",
        "FMC_A23",
        "EVENTOUT"
      ],
      "additionalFunctions": [],
      "functions": [
        {
          "name": "TRACECLK",
          "af": 0
        },
        {
          "name": "SAI1_CK1",
          "af": 2
        },
        {
          "name": "SPI4_SCK",
          "af": 5
        },
        {
          "name": "SAI1_MCLK_A",
          "af": 6
        },
        {
          "name": "SAI4_MCLK_A",
          "af": 8
        },
        {
          "name": "QUADSPI_BK1_IO2",
          "af": 9
        },
        {
          "name": "SAI4_CK1",
          "af": 10
        },
        {
          "name": "ETH_MII_TXD3",
          "af": 11
        },
        {
          "name": "FMC_A23",
          "af": 12
        },
        {
          "name": "EVENTOUT",
          "af": 15
        }
      ],
      "protection": []
    },
    {
      "number": 2,
      "name": "PE3",
      "resetName": "PE3",
      "kind": "gpio",
      "ioType": "I/O",
      "ioStructure": "FT_h",
      "notes": "-",
      "alternateSummary": [
        "TRACED0",
        "TIM15_BKIN",
        "SAI1_SD_B",
        "SAI4_SD_B",
        "FMC_A19",
        "EVENTOUT"
      ],
      "additionalFunctions": [],
      "functions": [
        {
          "name": "TRACED0",
          "af": 0
        },
        {
          "name": "TIM15_BKIN",
          "af": 4
        },
        {
          "name": "SAI1_SD_B",
          "af": 6
        },
        {
          "name": "SAI4_SD_B",
          "af": 8
        },
        {
          "name": "FMC_A19",
          "af": 12
        },
        {
          "name": "EVENTOUT",
          "af": 15
        }
      ],
      "protection": []
    },
    {
      "number": 3,
      "name": "PE4",
      "resetName": "PE4",
      "kind": "gpio",
      "ioType": "I/O",
      "ioStructure": "FT_h",
      "notes": "-",
      "alternateSummary": [
        "TRACED1",
        "SAI1_D2",
        "DFSDM1_DATIN3",
        "TIM15_CH1N",
        "SPI4_NSS",
        "SAI1_FS_A",
        "SAI4_FS_A",
        "SAI4_D2",
        "FMC_A20",
        "DCMI_D4",
        "LCD_B0",
        "EVENTOUT"
      ],
      "additionalFunctions": [],
      "functions": [
        {
          "name": "TRACED1",
          "af": 0
        },
        {
          "name": "SAI1_D2",
          "af": 2
        },
        {
          "name": "DFSDM1_DATIN3",
          "af": 3
        },
        {
          "name": "TIM15_CH1N",
          "af": 4
        },
        {
          "name": "SPI4_NSS",
          "af": 5
        },
        {
          "name": "SAI1_FS_A",
          "af": 6
        },
        {
          "name": "SAI4_FS_A",
          "af": 8
        },
        {
          "name": "SAI4_D2",
          "af": 10
        },
        {
          "name": "FMC_A20",
          "af": 12
        },
        {
          "name": "DCMI_D4",
          "af": 13
        },
        {
          "name": "LCD_B0",
          "af": 14
        },
        {
          "name": "EVENTOUT",
          "af": 15
        }
      ],
      "protection": []
    },
    {
      "number": 4,
      "name": "PE5",
      "resetName": "PE5",
      "kind": "gpio",
      "ioType": "I/O",
      "ioStructure": "FT_h",
      "notes": "-",
      "alternateSummary": [
        "TRACED2",
        "SAI1_CK2",
        "DFSDM1_CKIN3",
        "TIM15_CH1",
        "SPI4_MISO",
        "SAI1_SCK_A",
        "SAI4_SCK_A",
        "SAI4_CK2",
        "FMC_A21",
        "DCMI_D6",
        "LCD_G0",
        "EVENTOUT"
      ],
      "additionalFunctions": [],
      "functions": [
        {
          "name": "TRACED2",
          "af": 0
        },
        {
          "name": "SAI1_CK2",
          "af": 2
        },
        {
          "name": "DFSDM1_CKIN3",
          "af": 3
        },
        {
          "name": "TIM15_CH1",
          "af": 4
        },
        {
          "name": "SPI4_MISO",
          "af": 5
        },
        {
          "name": "SAI1_SCK_A",
          "af": 6
        },
        {
          "name": "SAI4_SCK_A",
          "af": 8
        },
        {
          "name": "SAI4_CK2",
          "af": 10
        },
        {
          "name": "FMC_A21",
          "af": 12
        },
        {
          "name": "DCMI_D6",
          "af": 13
        },
        {
          "name": "LCD_G0",
          "af": 14
        },
        {
          "name": "EVENTOUT",
          "af": 15
        }
      ],
      "protection": []
    },
    {
      "number": 5,
      "name": "PE6",
      "resetName": "PE6",
      "kind": "gpio",
      "ioType": "I/O",
      "ioStructure": "FT_h",
      "notes": "-",
      "alternateSummary": [
        "TRACED3",
        "TIM1_BKIN2",
        "SAI1_D1",
        "TIM15_CH2",
        "SPI4_MOSI",
        "SAI1_SD_A",
        "SAI4_SD_A",
        "SAI4_D1",
        "SAI2_MCLK_B",
        "TIM1_BKIN2_COMP12",
        "FMC_A22",
        "DCMI_D7",
        "LCD_G1",
        "EVENTOUT"
      ],
      "additionalFunctions": [],
      "functions": [
        {
          "name": "TRACED3",
          "af": 0
        },
        {
          "name": "TIM1_BKIN2",
          "af": 1
        },
        {
          "name": "SAI1_D1",
          "af": 2
        },
        {
          "name": "TIM15_CH2",
          "af": 4
        },
        {
          "name": "SPI4_MOSI",
          "af": 5
        },
        {
          "name": "SAI1_SD_A",
          "af": 6
        },
        {
          "name": "SAI4_SD_A",
          "af": 8
        },
        {
          "name": "SAI4_D1",
          "af": 9
        },
        {
          "name": "SAI2_MCLK_B",
          "af": 10
        },
        {
          "name": "TIM1_BKIN2_COMP12",
          "af": 11
        },
        {
          "name": "FMC_A22",
          "af": 12
        },
        {
          "name": "DCMI_D7",
          "af": 13
        },
        {
          "name": "LCD_G1",
          "af": 14
        },
        {
          "name": "EVENTOUT",
          "af": 15
        }
      ],
      "protection": []
    },
    {
      "number": 6,
      "name": "VBAT",
      "resetName": "VBAT",
      "kind": "supply",
      "ioType": "S",
      "ioStructure": "-",
      "notes": "-",
      "alternateSummary": [],
      "additionalFunctions": [],
      "functions": [],
      "protection": []
    },
    {
      "number": 7,
      "name": "PC13",
      "resetName": "PC13",
      "kind": "gpio",
      "ioType": "I/O",
      "ioStructure": "FT",
      "notes": "-",
      "alternateSummary": [
        "EVENTOUT"
      ],
      "additionalFunctions": [
        "RTC_OUT/RTC_TAMP1/RTC_TS/WKUP4"
      ],
      "functions": [
        {
          "name": "EVENTOUT",
          "af": 15
        }
      ],
      "protection": []
    },
    {
      "number": 8,
      "name": "PC14",
      "resetName": "PC14-OSC32_IN(OSC32_IN)(1)",
      "kind": "gpio",
      "ioType": "I/O",
      "ioStructure": "FT",
      "notes": "-",
      "alternateSummary": [
        "EVENTOUT"
      ],
      "additionalFunctions": [
        "OSC32_IN"
      ],
      "functions": [
        {
          "name": "EVENTOUT",
          "af": 15
        }
      ],
      "protection": [
        "oscillator"
      ]
    },
    {
      "number": 9,
      "name": "PC15",
      "resetName": "PC15-OSC32_OUT(OSC32_OUT)(1)",
      "kind": "gpio",
      "ioType": "I/O",
      "ioStructure": "FT",
      "notes": "-",
      "alternateSummary": [
        "EVENTOUT"
      ],
      "additionalFunctions": [
        "OSC32_OUT"
      ],
      "functions": [
        {
          "name": "EVENTOUT",
          "af": 15
        }
      ],
      "protection": [
        "oscillator"
      ]
    },
    {
      "number": 10,
      "name": "VSS",
      "resetName": "VSS",
      "kind": "supply",
      "ioType": "S",
      "ioStructure": "-",
      "notes": "-",
      "alternateSummary": [],
      "additionalFunctions": [],
      "functions": [],
      "protection": []
    },
    {
      "number": 11,
      "name": "VDD",
      "resetName": "VDD",
      "kind": "supply",
      "ioType": "S",
      "ioStructure": "-",
      "notes": "-",
      "alternateSummary": [],
      "additionalFunctions": [],
      "functions": [],
      "protection": []
    },
    {
      "number": 12,
      "name": "PH0",
      "resetName": "PH0-OSC_IN(PH0)",
      "kind": "gpio",
      "ioType": "I/O",
      "ioStructure": "FT",
      "notes": "-",
      "alternateSummary": [
        "EVENTOUT"
      ],
      "additionalFunctions": [
        "OSC_IN"
      ],
      "functions": [
        {
          "name": "EVENTOUT",
          "af": 15
        }
      ],
      "protection": [
        "oscillator"
      ]
    },
    {
      "number": 13,
      "name": "PH1",
      "resetName": "PH1-OSC_OUT(PH1)",
      "kind": "gpio",